ID;name;bio;birthDate
5ebc5455-f2d6-472e-af6f-3b68e544b6ee;Jane Austen;An English novelist known for her works exploring the British landed gentry;1775-12-16
c5090612-244e-4cf5-99f4-eb22cba2c4c1;Mark Twain;An American writer known for his novels about the American South;1835-11-30
10238591-2b1d-4f04-86ff-1d861f17da92;George Orwell;An English novelist and essayist known for his criticism of totalitarianism;1903-06-25
b7c342a1-21b3-45ef-bcc7-93f6a69cc95d;J.K. Rowling;A British author best known for the Harry Potter series;1965-07-31
fcdcd458-9815-445f-bc3b-84a0089e112c;Stephen King;An American author known for his horror, supernatural fiction, suspense, and fantasy novels;1947-09-21